"Area","Status","Evidence","NextAction"
"Promoted profile","KEEP_CURRENT","Current promoted profile remains risk1p6_sl18_tp35: full-period +866.59, split aggregate +2354.65, monthly/quarter aggregate +744.03, zero losing validation windows in existing evidence.","Do not replace until a candidate passes phase-2 real ticks plus the full promotion gate."
"Profit search evidence","WAITING_FOR_REPORTS","21 of 21 profile/phase rows require missing MT5 reports; 0 rows are rejected.","Import/export the missing reports, then rerun collector, ranking, decision matrix, and promotion packet scripts."
"Promotion gate","TRACKED","Promotion gate rows available: 4. Current passing/default-related rows: 1.","Only promote a new candidate if its gate status passes all full, split, quarter, and month evidence checks."
"Handoff integrity","PASS","24 handoff rows checked with no detected failures.","Use the handoff pack only during a controlled non-interrupting tester window."
"Local PC safety","PASS","18 safety checks pass; local launch remains locked unless explicit unlock and env flag are set.","Keep MT5 local launch disabled while the PC is in normal use."
"Replacement readiness","NOT_READY","No candidate has enough imported evidence to replace the current promoted profile.","Gather reports for the prioritized phase-1 batch without changing the live promoted settings."
