"Area","Status","Actual","Required","Evidence","NextAction"
"profile-source","PASS","exists=True; hash=7AA4135B6FBA2FFC59B48E6EB68E0F7E954AB9BA18054BCA3E658AC0FEAD6BAF; evidenceProfile=trade_ready_conservative; evidenceSource=A167CDB787E09F6E97B961D46963452527936434245FC42C7593E94EDF504622; evidenceRun=trade_ready_conservative_validation","Conservative profile exists with evidence identity","outputs\CANDIDATE_TRADE_READY_CONSERVATIVE_PROFILE.set","Generate the conservative trade-ready profile."
"live-readiness-decision","PENDING","rows=14; pass=7; pending=7; fail=0","Final live-readiness decision has zero pending and zero failed gates","outputs\TRADE_READY_LIVE_READINESS_DECISION.csv","Close every live-readiness gate before release review."
"money-ready-scorecard","PENDING","rows=20; pass=7; pending=13; fail=0","Money-ready scorecard has zero pending and zero failed rows","outputs\MONEY_READY_STATUS_SCORECARD.csv","Regenerate the scorecard after proof gates pass."
"locked-release-profile","PASS","written=outputs\TRADE_READY_RELEASE_PROFILE_LOCKED.set","A locked profile is always written for paper/demo use","outputs\TRADE_READY_RELEASE_PROFILE_LOCKED.set","Use this profile only for demo/paper or tester work."
"approval-identity","PENDING","evidence not complete; live approval ignored","Approval identity is only considered after evidence gates pass","command parameters","Finish proof gates first."
"manual-live-review-profile","PENDING","not written; verdict=NOT_RELEASEABLE_PENDING_EVIDENCE","No live-review profile is written until evidence and explicit approval both pass","outputs\TRADE_READY_MANUAL_LIVE_REVIEW_PROFILE.set","Do not create or use a real-account profile yet."
